model,vector_store,type,question,answer
dolphin3,Summary_TheRoleofBigDatainSmartHealthcarepdf_dolphin3,summary,What is the main research problem or question addressed in the paper?,"The main research problem or question addressed in the paper revolves around the potential benefits, challenges, and applications of big data analytics in the healthcare sector. Specifically, it explores how big data can improve patient outcomes, optimize hospital operations, enhance public health measures, and support value-based care through various European initiatives."
dolphin3,Raw_TheRoleofBigDatainSmartHealthcarepdf_dolphin3,raw,What is the main research problem or question addressed in the paper?,"The main research problem or question addressed in this paper revolves around the application and impact of big data analytics capabilities (BDAC) on supply chain integration (SCI) and operational flexibility in hospitals, as well as its potential to improve disease management in healthcare. The authors propose a research model based on organizational information processing theory (OIPT) to explore these aspects."
dolphin3,Summary_TheRoleofBigDatainSmartHealthcarepdf_dolphin3,summary,What methodology or approach has been used to solve the problem or answer the question?,"The method used to address the various challenges and questions associated with applying big data analytics in healthcare includes detailed analysis, case studies, real-world examples, and discussions of European initiatives. This approach allows for a comprehensive understanding of the potential benefits, ongoing projects, and hurdles that need to be addressed when implementing big data technologies within the healthcare system."
dolphin3,Raw_TheRoleofBigDatainSmartHealthcarepdf_dolphin3,raw,What methodology or approach has been used to solve the problem or answer the question?,"The methodologies or approaches that have been used to solve problems or answer questions in healthcare data analysis and big data analytics include:

1. Organizational Information Processing Theory (OIPT) for studying the impact of big data analytics capability on supply chain integration and operational flexibility in hospitals [27].

2. Integrative analytic approach for cancer genomics, which takes multi-scale biological interactions into consideration for model development and was applied to a public lung cancer dataset from an 18-year clinical study [28].

3. Big data analytics for preventive medicine, using neural computing techniques to analyze large datasets for healthcare research [20].

4. Prescriptive analytics in precision medicine to influence decision-making processes, using big data analysis techniques [21].

5. Systematic review of literature on the use of big data analytics in healthcare organization management [23]. 

These methodologies and approaches involve various data processing steps like data cleaning, integration, analysis, and visualization, as well as the application of statistical and machine learning techniques to extract insights from large volumes of healthcare data."
dolphin3,Summary_TheRoleofBigDatainSmartHealthcarepdf_dolphin3,summary,What are the key findings or results of the study?,"The key findings of this study include the various applications and examples of big data analytics in healthcare, European initiatives aimed at leveraging big data for value-based care, and the potential benefits and challenges of using big data in healthcare. The study also highlights that fully realizing these benefits requires addressing issues such as data privacy, interoperability, and navigating regulatory environments."
dolphin3,Raw_TheRoleofBigDatainSmartHealthcarepdf_dolphin3,raw,What are the key findings or results of the study?,"The key findings of the study by Yu et al. (2021) include:

1. The impact of big data analytics capability on supply chain integration and operational flexibility in hospitals was studied using an organizational information processing theory perspective.
2. The research model proposed by the authors aims to investigate how big data analytics capability influences these two aspects in healthcare organizations.

In summary, this study explores the relationship between big data analytics capability and hospital supply chain integration and operational flexibility, with implications for improving healthcare operations and patient outcomes."
dolphin3,Summary_TheRoleofBigDatainSmartHealthcarepdf_dolphin3,summary,What are the limitations of the research mentioned in the paper?,"The text does not explicitly state any limitations of the research it mentions. However, based on the context provided about big data analytics in healthcare, some potential limitations could include:

1. Data Privacy and Security: As mentioned earlier, ensuring data privacy and security is a challenge in big data analytics. If not addressed properly, sensitive patient information may be compromised.

2. Interoperability: Different systems and formats of medical records can hinder the effective use of big data. Improving interoperability between various healthcare IT systems is essential to fully exploit the potential benefits of big data analytics.

3. Regulatory Environment: Navigating the regulatory environment for big data in healthcare can be complex, with differences from country to country, particularly in Europe.

4. Data Quality and Availability: The accuracy and completeness of health data are crucial for reliable insights. Poor data quality or unavailability of certain types of data could limit the usefulness of analytics.

5. Over-Reliance on Technology: There's a risk that decision-making may become overly dependent on technology, potentially overlooking human judgment and context-specific factors in healthcare.

6. Skills and Expertise: The successful implementation of big data analytics requires specialized skills and expertise. A shortage or lack of these could limit the adoption and effective use of such technologies.

While the paper doesn't explicitly mention limitations, understanding these potential challenges is important to fully appreciate the context and implications of big data in healthcare."
dolphin3,Raw_TheRoleofBigDatainSmartHealthcarepdf_dolphin3,raw,What are the limitations of the research mentioned in the paper?,"The research on big data analytics in healthcare mentioned in the paper has several limitations:

1. Data privacy and personal autonomy concerns: The use of big data in healthcare raises potential risks of breaching patient privacy and infringing on personal autonomy.

2. Interpretation and explanation challenges: Predictive models and algorithms used for extracting insights from big data can be difficult to interpret and explain, making it challenging to understand how these models arrive at certain predictions or recommendations.

3. Lack of infrastructure and resources: Implementing big data solutions in healthcare organizations can be expensive, and many may lack the necessary infrastructure and resources to support such initiatives.

4. Management challenges: Fully leveraging big data analytics in healthcare requires effective management strategies, including data governance and information governance, which ensure data quality through cleanliness, accuracy, consistency, and accessibility.

5. Variability of data change: The rapid pace of change in healthcare data raises concerns about the relevance and usefulness of the data, historical data inclusion in analysis, and data storage duration before archiving or deletion.

6. Limited human judgment: Human analysts and traditional statistical techniques are still essential in interpreting big data analytics results due to their limitations in matching the judgment of a human analyst.

7. Need for strategies like data governance: Healthcare organizations must employ strategies such as data governance to ensure data quality, especially when consolidating older data sources into new platforms.

8. Decision-making challenges: The increasing volume of data in healthcare raises questions about what historical data should be included in analysis and how long the data should be stored before archiving or deletion. These decisions will become more critical as data volumes continue to rise.

9. Ethical and legal challenges: There can be concerns related to privacy, personal autonomy, public trust, transparency, fairness, and compliance with legal standards when using big data in healthcare."
dolphin3,Summary_TheRoleofBigDatainSmartHealthcarepdf_dolphin3,summary,How does this research build upon or differ from previous studies in the field?,"This research builds upon previous studies by providing concrete examples of how big data analytics is being applied in healthcare across Europe. It differs from previous studies in its comprehensive list of 21 applications, as well as its focus on European initiatives, which provides a unique perspective on how different regions are approaching the use of big data in healthcare."
dolphin3,Raw_TheRoleofBigDatainSmartHealthcarepdf_dolphin3,raw,How does this research build upon or differ from previous studies in the field?,"This research focuses on the impact of big data analytics capability (BDAC) on supply chain integration (SCI) and operational flexibility in hospitals, as well as the potential of big data analytics in uncovering useful information for disease management. It builds upon previous studies by applying organizational information processing theory (OIPT), multi-scale biological interactions, and various big data analytics techniques to analyze healthcare data.

However, it differs from previous studies by focusing specifically on hospital operations, SCI, and disease management. While other studies have explored the potential of big data in healthcare, this research provides a more targeted approach with specific goals related to improving hospital efficiency and patient outcomes.

Overall, this research contributes to the growing body of knowledge on big data analytics in healthcare and highlights the importance of using advanced analytical techniques to uncover meaningful insights from large datasets."
dolphin3,Summary_TheRoleofBigDatainSmartHealthcarepdf_dolphin3,summary,"What data or evidence has been used, and how was it collected or analyzed?","The article likely drew from various sources such as electronic health records (EHRs), claims data, clinical trial databases, genomic data, patient-reported outcomes, and other types of healthcare data. The methods for analysis could range from statistical modeling to machine learning algorithms depending on the specific application of big data analytics in healthcare being discussed.

Data collection might have involved aggregating existing datasets or conducting new research studies with a focus on generating large-scale, high-quality data sets that can be analyzed computationally. These datasets are often massive and come from a variety of sources including hospitals, medical practices, health insurance companies, research institutions, and public health agencies.

Once collected, the data is typically cleaned to remove inconsistencies, errors, or missing values. It's then processed using various computational techniques such as data mining, machine learning, and predictive modeling to extract insights that could not be obtained through traditional manual analysis methods.

For instance, analyzing large sets of genomic data with machine learning algorithms can reveal patterns associated with disease susceptibility or drug response that may not be apparent through conventional research approaches. Similarly, applying big data analytics to EHRs might help identify trends in patient outcomes related to different treatments for the same condition.

Each example provided in the article likely involved a specific analytical approach tailored to the nature and availability of the health-related data at hand."
dolphin3,Raw_TheRoleofBigDatainSmartHealthcarepdf_dolphin3,raw,"What data or evidence has been used, and how was it collected or analyzed?","The data mentioned includes claims data, patient-generated data, and data from wearable devices. The process involves several steps such as data cleaning and preprocessing to remove errors, outliers, and inconsistencies, data integration to create a comprehensive dataset for analysis by mapping and merging data from different sources, applying analytics techniques like descriptive, predictive, and prescriptive analytics to extract insights and generate reports, and finally, using data visualization to present the results.

To ensure data quality, strategies such as data governance, ensuring the security and privacy of patient information through data protection best practices, and addressing variability or how often the data changes are important considerations. Additionally, human analysts and traditional statistical techniques still play a role in this process, especially regarding the judgment aspect of veracity.

Some examples mentioned include:

1. A healthcare organization found multiple patients with the same Patient ID due to consolidating older data sources into a new data platform.
2. West systematic analysis of breast cancer morphology uncovered stromal features associated with survival.
3. Adverse drug event discovery using biomedical literature through big data neural networks.

These examples involve different types of data collection and analysis, ranging from patient data integration issues to the use of big data analytics in medical research for specific purposes."
dolphin3,Summary_TheRoleofBigDatainSmartHealthcarepdf_dolphin3,summary,What are the implications or practical applications of the findings?,"The implications and practical applications of the findings discussed in the system include:

1. **Improved Patient Outcomes**: Big data analytics can be used to improve patient outcomes by enabling early detection of diseases, reducing adverse drug reactions, and optimizing treatment plans based on individual patient data.

2. **Enhanced Operational Efficiency**: Analytics can help optimize hospital operations such as staffing levels, resource allocation, and streamlining workflows, leading to improved efficiency and cost savings.

3. **Public Health Surveillance and Prevention**: Big data analytics plays a crucial role in public health surveillance by analyzing large volumes of data to identify disease outbreaks, track epidemics, and develop predictive models for disease prevention strategies.

4. **Personalized Medicine**: With the help of big data analytics, healthcare providers can offer more personalized medicine tailored to individual patient needs based on their genetic profiles, medical history, and lifestyle factors.

5. **Value-Based Care**: Big data analytics supports value-based care by allowing healthcare providers to make informed decisions regarding the most effective treatments and resources allocation, leading to better health outcomes for patients while reducing costs.

6. **Research and Development**: Analytics can accelerate drug discovery and development by analyzing vast amounts of clinical trial data, genomic information, and other health-related datasets to identify patterns and correlations that may lead to new therapeutic interventions.

Overall, the practical applications of big data analytics in healthcare are numerous and diverse, promising significant improvements across patient care, public health, research, and healthcare operations."
dolphin3,Raw_TheRoleofBigDatainSmartHealthcarepdf_dolphin3,raw,What are the implications or practical applications of the findings?,"The implications and practical applications of the findings include:

1) The potential for big data analytics to uncover new disease markers and drug targets in cancer genomics, which can lead to improved treatment options for patients.

2) The ability of big data analytics to improve patient care and increase efficiency and value in healthcare organizations through better supply chain integration and operational flexibility.

3) The need for healthcare organizations to adapt their operations and processes to fully take advantage of the potential benefits of big data analytics, which may involve hiring specialized staff or upgrading IT infrastructure.

4) The importance of addressing challenges related to data protection, governance, integration, analytics and modeling, as well as data bias and other ethical concerns in order to ensure that big data is used responsibly and legally."
dolphin3,Summary_TheRoleofBigDatainSmartHealthcarepdf_dolphin3,summary,"What assumptions are made in the study, and are they justified?","The study assumes that big data analytics has potential benefits in transforming healthcare through data-driven decision-making. This assumption is justified as there is evidence to show that big data analytics can lead to better patient outcomes, improved processes, and optimized hospital operations.

Another assumption made is that the challenges of implementing big data technologies in healthcare, such as data privacy concerns and interoperability issues, can be overcome with appropriate measures and policies. While this assumption may not yet be fully justified since these challenges are still being addressed, it is a logical expectation given the ongoing efforts to improve data privacy and interoperability standards.

Overall, the assumptions made in the study seem reasonable and are supported by real-world applications of big data analytics in healthcare."
dolphin3,Raw_TheRoleofBigDatainSmartHealthcarepdf_dolphin3,raw,"What assumptions are made in the study, and are they justified?","The study assumes that healthcare organizations have a strong infrastructure to support the implementation of big data solutions and that the necessary resources (both financial and technical) are available. It also assumes that there is a clear understanding of how to use big data analytics to improve patient outcomes and the quality of care provided.

These assumptions may not be fully justified as some healthcare organizations may lack the necessary infrastructure, financial support, or expertise required for implementing big data solutions. Additionally, interpreting and explaining the insights gained from big data can pose challenges, which might limit its effective utilization in healthcare."
dolphin3,Summary_TheRoleofBigDatainSmartHealthcarepdf_dolphin3,summary,Are there any unanswered questions or suggested areas for future research?,"Some potential areas for future research could include:

1. **Improved Data Privacy Solutions**: As one of the main challenges in implementing big data analytics in healthcare is ensuring patient privacy, further exploration into innovative data protection methods and technologies would be beneficial.

2. **Enhancing Interoperability Standards**: Developing more comprehensive and universal interoperability standards can help facilitate seamless data sharing across different systems and institutions.

3. **Investigating New Applications of Big Data Analytics**: Continued research into additional areas where big data analytics could have a positive impact on healthcare, such as personalized medicine or optimizing treatment pathways, would be valuable.

4. **Evaluation of Existing Initiatives**: Assessing the effectiveness and long-term impacts of existing initiatives that utilize big data analytics in healthcare can provide insights for future projects and help identify best practices.

5. **Addressing Regulatory Barriers**: Further exploration into the regulatory environment surrounding big data analytics in healthcare, as well as potential solutions to navigate these challenges effectively, is an important area for study."
dolphin3,Raw_TheRoleofBigDatainSmartHealthcarepdf_dolphin3,raw,Are there any unanswered questions or suggested areas for future research?,"Yes, there are several unanswered questions and suggested areas for future research in the field of population health and big data analytics in healthcare. Some potential areas include:

1. Developing more effective strategies to address management challenges associated with implementing big data solutions.
2. Investigating ways to improve data interpretation and explanation abilities to enhance the understanding and use of predictive models and algorithms.
3. Examining methods to ensure data quality and integrity, such as data governance and information governance.
4. Studying techniques for handling the variability in healthcare data, including decisions related to historical data inclusion and storage duration.
5. Exploring approaches to address potential privacy, personal autonomy, public trust, transparency, and fairness concerns associated with big data use in healthcare.

Overall, further research is needed to maximize the benefits of big data analytics in population health and healthcare while addressing various challenges and considerations."
dolphin3,Summary_TheRoleofBigDatainSmartHealthcarepdf_dolphin3,summary,"How does the research contribute to its field, and why is it important?","The research on big data analytics in healthcare contributes significantly to its field by highlighting the transformative potential of this technology. It not only showcases various applications where big data has been successfully implemented to improve patient outcomes and streamline processes but also emphasizes the importance of overcoming challenges like ensuring privacy, interoperability, and navigating regulatory environments.

By discussing these examples and initiatives in Europe, the research provides a comprehensive understanding of how different regions are approaching the integration of big data into their healthcare systems. The analysis is important because it underscores the potential benefits of adopting a data-driven approach to medical research and public health policy, which could ultimately lead to better health outcomes for patients and more efficient healthcare delivery systems."
dolphin3,Raw_TheRoleofBigDatainSmartHealthcarepdf_dolphin3,raw,"How does the research contribute to its field, and why is it important?","The research contributes to the medical field in several ways:

1. Identifying early warning signs of serious illnesses: By analyzing large data samples, doctors can identify potential early warning signs of diseases that may not have been apparent before. This allows for simpler and more cost-effective treatment.

2. Improved decision-making for healthcare administrators: Big data analytics enable administrators to make informed decisions about funding and resource allocation based on key performance indicators. This results in better management of resources and improved overall efficiency in the healthcare system.

3. Discovery of new disease markers and drug targets: Research has shown that big data analytics can uncover valuable information from large datasets, such as identifying new disease markers and drug targets for cancer genomics.

4. Personalized health services: By combining emerging wearable clothing technology with cloud computing, big data, and machine learning techniques, the research proposes a healthcare system that provides personalized healthcare services through monitoring of basic physiological information.

5. Predicting disease trends: Big Data analysis on large historical data can predict disease trends, allowing for better forecasting of users' health status and more effective prevention measures.

The importance of this research lies in its potential to revolutionize the healthcare field by creating new opportunities for diagnosis, prevention, personalized treatment, research, and cost reduction. It also highlights the need to address and mitigate challenges such as data privacy, security, and management to ensure the progress of big data in healthcare."
